{
  "schemaVersion": "1.0.0",
  "manufacturer": "gobilda",
  "displayName": "goBILDA",
  "notes": "Official CAD is downloaded from goBILDA product STEP ZIPs under /content/step_files/. URLs were HEAD-checked before downloadEnabled was set. Collision boxes are authored proxies; converted convex hulls are generated on cache. Cross-brand mounts require a real adapter.",
  "coordinateSystem": "manufacturer_mm_zup",
  "parts": [
    {
      "sku": "1120-0001-0048",
      "displayName": "1120 Series U-Channel (48 mm)",
      "productUrl": "https://www.gobilda.com/1120-series-u-channel",
      "cad": {
        "sourceUrl": "https://www.gobilda.com/content/step_files/1120-0001-0048.zip",
        "filename": "1120-0001-0048.zip",
        "format": "zip",
        "units": "mm",
        "origin": "manufacturer",
        "downloadEnabled": true,
        "terms": "Official goBILDA STEP ZIP for team robot design; TalonGym caches a converted copy locally and does not rehost the source CAD."
      },
      "massKg": 0.028,
      "visualTransform": {
        "scaleToInches": 0.03937007874015748,
        "rotatedZupToYup": true,
        "translationIn": [
          0.0,
          0.0,
          0.0
        ]
      },
      "collision": [
        {
          "kind": "box",
          "sizeIn": [
            1.8898,
            1.8898,
            0.4724
          ]
        }
      ],
      "tags": [
        "channel"
      ],
      "mounts": [
        {
          "id": "web",
          "kind": "clearance_hole",
          "standard": "gobilda_pattern",
          "diameterMm": 4.0,
          "spacingMm": 8.0,
          "axis": [
            0.0,
            0.0,
            1.0
          ],
          "uAxis": [
            1.0,
            0.0,
            0.0
          ],
          "depthMm": 4.0,
          "allowedHardware": [
            "m4_screw"
          ],
          "transform": {
            "x": 0,
            "y": 0,
            "z": 0.0
          },
          "pattern": {
            "type": "grid",
            "pitchMm": 8.0,
            "countU": 6,
            "countV": 3
          }
        },
        {
          "id": "flange_a",
          "kind": "clearance_hole",
          "standard": "gobilda_pattern",
          "diameterMm": 4.0,
          "spacingMm": 8.0,
          "axis": [
            0,
            1,
            0
          ],
          "depthMm": 4.0,
          "allowedHardware": [
            "m4_screw"
          ],
          "transform": {
            "x": 0,
            "y": 0,
            "z": 0.9449
          },
          "pattern": {
            "type": "grid",
            "pitchMm": 8.0,
            "countU": 6,
            "countV": 1
          }
        },
        {
          "id": "end_a",
          "kind": "mating_face",
          "standard": "gobilda_pattern",
          "axis": [
            0.0,
            0.0,
            1.0
          ],
          "transform": {
            "x": 0,
            "y": 0,
            "z": 0
          }
        }
      ]
    },
    {
      "sku": "1120-0004-0120",
      "displayName": "1120 Series U-Channel (120 mm)",
      "productUrl": "https://www.gobilda.com/1120-series-u-channel",
      "cad": {
        "sourceUrl": "https://www.gobilda.com/content/step_files/1120-0004-0120.zip",
        "filename": "1120-0004-0120.zip",
        "format": "zip",
        "units": "mm",
        "origin": "manufacturer",
        "downloadEnabled": true,
        "terms": "Official goBILDA STEP ZIP for team robot design; TalonGym caches a converted copy locally and does not rehost the source CAD."
      },
      "massKg": 0.07,
      "visualTransform": {
        "scaleToInches": 0.03937007874015748,
        "rotatedZupToYup": true,
        "translationIn": [
          0.0,
          0.0,
          0.0
        ]
      },
      "collision": [
        {
          "kind": "box",
          "sizeIn": [
            4.7244,
            1.8898,
            0.4724
          ]
        }
      ],
      "tags": [
        "channel"
      ],
      "mounts": [
        {
          "id": "web",
          "kind": "clearance_hole",
          "standard": "gobilda_pattern",
          "diameterMm": 4.0,
          "spacingMm": 8.0,
          "axis": [
            0.0,
            0.0,
            1.0
          ],
          "uAxis": [
            1.0,
            0.0,
            0.0
          ],
          "depthMm": 4.0,
          "allowedHardware": [
            "m4_screw"
          ],
          "transform": {
            "x": 0,
            "y": 0,
            "z": 0.0
          },
          "pattern": {
            "type": "grid",
            "pitchMm": 8.0,
            "countU": 15,
            "countV": 3
          }
        },
        {
          "id": "flange_a",
          "kind": "clearance_hole",
          "standard": "gobilda_pattern",
          "diameterMm": 4.0,
          "spacingMm": 8.0,
          "axis": [
            0,
            1,
            0
          ],
          "depthMm": 4.0,
          "allowedHardware": [
            "m4_screw"
          ],
          "transform": {
            "x": 0,
            "y": 0,
            "z": 0.9449
          },
          "pattern": {
            "type": "grid",
            "pitchMm": 8.0,
            "countU": 15,
            "countV": 1
          }
        },
        {
          "id": "end_a",
          "kind": "mating_face",
          "standard": "gobilda_pattern",
          "axis": [
            0.0,
            0.0,
            1.0
          ],
          "transform": {
            "x": 0,
            "y": 0,
            "z": 0
          }
        }
      ]
    },
    {
      "sku": "1120-0007-0192",
      "displayName": "1120 Series U-Channel (192 mm)",
      "productUrl": "https://www.gobilda.com/1120-series-u-channel",
      "cad": {
        "sourceUrl": "https://www.gobilda.com/content/step_files/1120-0007-0192.zip",
        "filename": "1120-0007-0192.zip",
        "format": "zip",
        "units": "mm",
        "origin": "manufacturer",
        "downloadEnabled": true,
        "terms": "Official goBILDA STEP ZIP for team robot design; TalonGym caches a converted copy locally and does not rehost the source CAD."
      },
      "massKg": 0.112,
      "visualTransform": {
        "scaleToInches": 0.03937007874015748,
        "rotatedZupToYup": true,
        "translationIn": [
          0.0,
          0.0,
          0.0
        ]
      },
      "collision": [
        {
          "kind": "box",
          "sizeIn": [
            7.5591,
            1.8898,
            0.4724
          ]
        }
      ],
      "tags": [
        "channel"
      ],
      "mounts": [
        {
          "id": "web",
          "kind": "clearance_hole",
          "standard": "gobilda_pattern",
          "diameterMm": 4.0,
          "spacingMm": 8.0,
          "axis": [
            0.0,
            0.0,
            1.0
          ],
          "uAxis": [
            1.0,
            0.0,
            0.0
          ],
          "depthMm": 4.0,
          "allowedHardware": [
            "m4_screw"
          ],
          "transform": {
            "x": 0,
            "y": 0,
            "z": 0.0
          },
          "pattern": {
            "type": "grid",
            "pitchMm": 8.0,
            "countU": 24,
            "countV": 3
          }
        },
        {
          "id": "flange_a",
          "kind": "clearance_hole",
          "standard": "gobilda_pattern",
          "diameterMm": 4.0,
          "spacingMm": 8.0,
          "axis": [
            0,
            1,
            0
          ],
          "depthMm": 4.0,
          "allowedHardware": [
            "m4_screw"
          ],
          "transform": {
            "x": 0,
            "y": 0,
            "z": 0.9449
          },
          "pattern": {
            "type": "grid",
            "pitchMm": 8.0,
            "countU": 24,
            "countV": 1
          }
        },
        {
          "id": "end_a",
          "kind": "mating_face",
          "standard": "gobilda_pattern",
          "axis": [
            0.0,
            0.0,
            1.0
          ],
          "transform": {
            "x": 0,
            "y": 0,
            "z": 0
          }
        }
      ]
    },
    {
      "sku": "1120-0013-0336",
      "displayName": "1120 Series U-Channel (336 mm)",
      "productUrl": "https://www.gobilda.com/1120-series-u-channel",
      "cad": {
        "sourceUrl": "https://www.gobilda.com/content/step_files/1120-0013-0336.zip",
        "filename": "1120-0013-0336.zip",
        "format": "zip",
        "units": "mm",
        "origin": "manufacturer",
        "downloadEnabled": true,
        "terms": "Official goBILDA STEP ZIP for team robot design; TalonGym caches a converted copy locally and does not rehost the source CAD."
      },
      "massKg": 0.196,
      "visualTransform": {
        "scaleToInches": 0.03937007874015748,
        "rotatedZupToYup": true,
        "translationIn": [
          0.0,
          0.0,
          0.0
        ]
      },
      "collision": [
        {
          "kind": "box",
          "sizeIn": [
            13.2283,
            1.8898,
            0.4724
          ]
        }
      ],
      "tags": [
        "channel"
      ],
      "mounts": [
        {
          "id": "web",
          "kind": "clearance_hole",
          "standard": "gobilda_pattern",
          "diameterMm": 4.0,
          "spacingMm": 8.0,
          "axis": [
            0.0,
            0.0,
            1.0
          ],
          "uAxis": [
            1.0,
            0.0,
            0.0
          ],
          "depthMm": 4.0,
          "allowedHardware": [
            "m4_screw"
          ],
          "transform": {
            "x": 0,
            "y": 0,
            "z": 0.0
          },
          "pattern": {
            "type": "grid",
            "pitchMm": 8.0,
            "countU": 42,
            "countV": 3
          }
        },
        {
          "id": "flange_a",